Source,Annotated,English
आमी सकाळी उठलो आन् शेताला गेलो. तिथं खूप काम होतं. दुपारपर्यंत राबलो.,आम्ही सकाळी उठलो आणि शेतात गेलो. तिथे खूप काम होते. दुपारपर्यंत काम केले.,We woke up in the morning and went to the farm. There was a lot of work. We worked until afternoon.
माझी आई रोज पहाटं उठती. चुलीवर चहा ठेवती आन् मग भाकरी थापती. घरातले सगळे उठण्याआधीच तिचं काम होऊन जातं.,माझी आई रोज पहाटे उठते. चुलीवर चहा ठेवते आणि मग भाकरी थापते. घरातील सर्वजण उठण्याआधीच तिचे काम होऊन जाते.,My mother wakes up early every morning. She puts tea on the stove and then makes bhakri. Her work is done before everyone in the house wakes up.
काल बाजारात गेलतो. खूप गर्दी होती. भाजी घेतली आन् लवकर घरला आलो.,काल बाजारात गेलो होतो. खूप गर्दी होती. भाजी घेतली आणि लवकर घरी आलो.,We had gone to the market yesterday. There was a lot of crowd. We bought vegetables and came home early.
पोरं शाळंतून आली आन् लगेच खेळाला पळाली. त्यांनी जेवण बी केलं नाय. आई खूप वैतागली.,मुले शाळेतून आली आणि लगेच खेळायला पळाली. त्यांनी जेवणही केले नाही. आई खूप वैतागली.,The children came from school and immediately ran to play. They did not even eat. Mother got very frustrated.
आमच्या गावात नदी हाय. पावसाळ्यात ती दुथडी भरून वाहती. सगळी पोरं तिथं डुंबायला जात्यात.,आमच्या गावात नदी आहे. पावसाळ्यात ती दुथडी भरून वाहते. सर्व मुले तिथे पोहायला जातात.,There is a river in our village. In the rainy season it flows to the brim. All the children go there to swim.
बाबा शेतातनं आले तवा खूप थकलेले व्हते. आईनं त्यांना पाणी दिलं. मग ते जेवून झोपले.,बाबा शेतातून आले तेव्हा खूप थकलेले होते. आईने त्यांना पाणी दिले. मग ते जेवून झोपले.,When father came from the farm he was very tired. Mother gave him water. Then he ate and slept.
आज शाळेत परीक्षा व्हती. मला खूप भ्या वाटत व्हतं. पण मी सगळे प्रश्न लिवले.,आज शाळेत परीक्षा होती. मला खूप भीती वाटत होती. पण मी सर्व प्रश्न लिहिले.,There was an exam at school today. I was very scared. But I wrote all the questions.
आमच्या घराजवळ एक म्हातारा राहतो. तो रोज संध्याकाळी झाडाखाली बसतो. गावातली पोरं त्याच्याजवळ गोष्टी ऐकायला येत्यात.,आमच्या घराजवळ एक म्हातारा राहतो. तो रोज संध्याकाळी झाडाखाली बसतो. गावातील मुले त्याच्याजवळ गोष्टी ऐकायला येतात.,An old man lives near our house. He sits under the tree every evening. Village children come to him to listen to stories.
पाऊस आला आन् सगळे शेतकरी खूश झाले. महिनाभर पाण्याची वाट बघत व्हते. आता पेरणी करता येईल.,पाऊस आला आणि सर्व शेतकरी खूश झाले. महिनाभर पाण्याची वाट पाहत होते. आता पेरणी करता येईल.,The rain came and all the farmers were happy. They had been waiting for water for a month. Now sowing can be done.
माझा मोठा भाऊ शहरात नोकरी करतो. तो महिन्यातनं एकदा घरला येतो. तो आला की घरात आनंद असतो.,माझा मोठा भाऊ शहरात नोकरी करतो. तो महिन्यातून एकदा घरी येतो. तो आला की घरात आनंद असतो.,My elder brother works in the city. He comes home once a month. When he comes there is happiness at home.
गावात एक नवीन शाळा बांधली. आता पोरांला लांब जावं लागत नाय. सगळे खूश हायत.,गावात एक नवीन शाळा बांधली. आता मुलांना लांब जावे लागत नाही. सर्वजण खूश आहेत.,A new school was built in the village. Now the children do not have to go far. Everyone is happy.
आमची गाय दोन दिवसांपासनं काय खात नाय. बाबा तिला डाक्तरकडं न्यायला निघाले. आम्हाला तिची खूप काळजी वाटतीय.,आमची गाय दोन दिवसांपासून काही खात नाही. बाबा तिला डॉक्टरकडे न्यायला निघाले. आम्हाला तिची खूप काळजी वाटत आहे.,Our cow has not been eating for two days. Father is leaving to take her to the doctor. We are very worried about her.
संध्याकाळी सगळे एकत्र जेवत बसतो. आई सांगते गोष्टी. बाबा हसत असत्यात.,संध्याकाळी सर्वजण एकत्र जेवायला बसतो. आई गोष्टी सांगते. बाबा हसत असतात.,In the evening everyone sits together to eat. Mother tells stories. Father keeps laughing.
आमच्या गावात यंदा उत्सव झाला. खूप मोठी यात्रा भरली. दुरून बी लोक आले व्हते.,आमच्या गावात यंदा उत्सव झाला. खूप मोठी यात्रा भरली. दुरूनही लोक आले होते.,This year there was a festival in our village. A very big fair was held. People had come from far away too.
त्या दिवशी खूप ऊन व्हतं. सावलीत बसायला जागा नव्हती. आम्ही झाडाखाली विसावलो.,त्या दिवशी खूप उन्हाळा होता. सावलीत बसायला जागा नव्हती. आम्ही झाडाखाली विश्रांती घेतली.,That day it was very hot. There was no place to sit in the shade. We rested under a tree.
माझी आजी रोज देवाला नमस्कार करती. मग ती स्वयंपाकाला बसती. ती सांगते देव सगळं बघतो.,माझी आजी रोज देवाला नमस्कार करते. मग ती स्वयंपाकाला बसते. ती सांगते की देव सर्व काही पाहतो.,My grandmother greets God every day. Then she sits down to cook. She says that God sees everything.
रात्री वीज गेली आन् घरात अंधार झाला. मुलं घाबरली. आईनं मेणबत्ती लावली.,रात्री वीज गेली आणि घरात अंधार झाला. मुले घाबरली. आईने मेणबत्ती लावली.,The electricity went out at night and the house became dark. The children got scared. Mother lit a candle.
माझ्या मित्राच्या घरी लग्न होतं. आम्ही सगळे गेलतो. खूप मजा आली.,माझ्या मित्राच्या घरी लग्न होते. आम्ही सर्वजण गेलो होतो. खूप मजा आली.,There was a wedding at my friend's house. We had all gone. We had a lot of fun.
शेतात पीक चांगलं आलंय. बाबा म्हणत्यात यंदा कर्ज फेडता येईल. घरात सगळे खूश हायत.,शेतात पीक चांगले आले आहे. बाबा म्हणतात यंदा कर्ज फेडता येईल. घरात सर्वजण खूश आहेत.,The crop in the field has grown well. Father says the loan can be repaid this year. Everyone at home is happy.
आई रोज सकाळी भाजी निवडती. मग ती चिरती. स्वयंपाक करताना गाणं म्हणती.,आई रोज सकाळी भाजी निवडते. मग ती चिरते. स्वयंपाक करताना गाणे म्हणते.,Mother sorts vegetables every morning. Then she chops them. She sings while cooking.
लहान पोरांला शाळेत दाखल केलं. ते रडत व्हतं. पण हळूहळू रमलं.,लहान मुलाला शाळेत दाखल केले. ते रडत होते. पण हळूहळू रमले.,The young child was enrolled in school. They were crying. But slowly they settled in.
आमच्या शेजारी नवीन कुटुंब आलंय. ते शहरातनं आलेत. आम्ही त्यांना ओळख करून दिली.,आमच्या शेजारी नवीन कुटुंब आले आहे. ते शहरातून आले आहेत. आम्ही त्यांना ओळख करून दिली.,A new family has come next to us. They have come from the city. We introduced ourselves to them.
पावसाळ्यात रस्ते खराब होत्यात. चालायला त्रास होतो. गाड्या बी अडकत्यात.,पावसाळ्यात रस्ते खराब होतात. चालायला त्रास होतो. गाड्याही अडकतात.,Roads get damaged during the rainy season. It is difficult to walk. Vehicles also get stuck.
माझा धाकटा भाऊ खूप खोडकर हाय. तो सारखा भांडतो. पण आम्हाला त्याची खूप माया हाय.,माझा धाकटा भाऊ खूप खोडकर आहे. तो सारखा भांडतो. पण आम्हाला त्याची खूप माया आहे.,My younger brother is very mischievous. He keeps fighting. But we love him very much.
आजोबा सकाळी फेरफटका मारायला जात्यात. वाटेत ओळखीच्या लोकांशी बोलत्यात. तासभर बाहेर असत्यात.,आजोबा सकाळी फेरफटका मारायला जातात. वाटेत ओळखीच्या लोकांशी बोलतात. तासभर बाहेर असतात.,Grandfather goes for a walk in the morning. He talks to acquaintances on the way. He is outside for about an hour.
आमच्या गावचं पाणी खूप गोड हाय. विहिरीतनं काढतो. उन्हाळ्यात बी थंड असतं.,आमच्या गावचे पाणी खूप गोड आहे. विहिरीतून काढतो. उन्हाळ्यातही थंड असते.,The water in our village is very sweet. We draw it from a well. It is cold even in summer.
मला शाळेत बक्षीस मिळालं. आईला सांगितलं तवा ती खूप खूश झाली. बाबांनी शाब्बासकी दिली.,मला शाळेत बक्षीस मिळाले. आईला सांगितले तेव्हा ती खूप खूश झाली. बाबांनी शाब्बासकी दिली.,I got a prize at school. When I told mother she was very happy. Father gave me praise.
रात्री जेवण झाल्यावर सगळे अंगणात बसत्यात. चांदण्यात गप्पा मारत्यात. उशिरापर्यंत जागत्यात.,रात्री जेवण झाल्यावर सर्वजण अंगणात बसतात. चांदण्यात गप्पा मारतात. उशिरापर्यंत जागतात.,After dinner at night everyone sits in the courtyard. They chat in the moonlight. They stay awake till late.
आमच्या गावात एक मोठं झाड हाय. त्याच्या सावलीत बाजार भरतो. उन्हाळ्यात तिथं गारवा असतो.,आमच्या गावात एक मोठे झाड आहे. त्याच्या सावलीत बाजार भरतो. उन्हाळ्यात तिथे गारवा असतो.,There is a big tree in our village. The market is held in its shade. There is coolness there in summer.
माझी ताई लग्न होऊन सासरी गेली. घर सुनं सुनं वाटतंय. तिची खूप आठवण येती.,माझी ताई लग्न होऊन सासरी गेली. घर सुने सुने वाटते. तिची खूप आठवण येते.,My elder sister got married and went to her in-laws. The house feels very empty. I miss her a lot.
आम्ही दरवर्षी यात्रेला जातो. तिथनं खाऊ आणतो. पोरांना खूप आवडतं.,आम्ही दरवर्षी यात्रेला जातो. तिथून खाऊ आणतो. मुलांना खूप आवडते.,We go to the fair every year. We bring sweets from there. The children love it very much.
शेतात काम करताना हात दुखू लागले. थोडा वेळ विश्रांती घेतली. मग परत कामाला लागलो.,शेतात काम करताना हात दुखू लागले. थोडा वेळ विश्रांती घेतली. मग परत कामाला लागलो.,My hands started aching while working in the field. I rested for a while. Then I got back to work.
आमच्या गावात दवाखाना नाय. आजारी पडलो की शहरात जावं लागतं. खूप त्रास होतो.,आमच्या गावात दवाखाना नाही. आजारी पडलो की शहरात जावे लागते. खूप त्रास होतो.,There is no clinic in our village. When we fall sick we have to go to the city. It is very troublesome.
पोरांनी अभ्यास केला नाय म्हणून मास्तरांनी रागावले. मग सगळे गप्प बसले. उद्यापासनं नीट करू म्हणाले.,मुलांनी अभ्यास केला नाही म्हणून शिक्षकांनी रागावले. मग सर्वजण गप्प बसले. उद्यापासून नीट करू म्हणाले.,The teacher got angry because the children had not studied. Then everyone became quiet. They said they would do it properly from tomorrow.
आईनं भाकरी आन् ठेचा केला. जेवण साधं व्हतं पण खूप रुचकर व्हतं. ताटात काही शिल्लक राहिलं नाय.,आईने भाकरी आणि ठेचा केला. जेवण साधे होते पण खूप रुचकर होते. ताटात काही शिल्लक राहिले नाही.,Mother made bhakri and thecha. The food was simple but very tasty. Nothing remained on the plate.
उन्हाळ्यात शाळेला सुट्टी असती. आम्ही आजोळला जातो. तिथं खूप मजा येती.,उन्हाळ्यात शाळेला सुट्टी असते. आम्ही आजोळी जातो. तिथे खूप मजा येते.,There are holidays from school in summer. We go to the maternal grandparents place. We have a lot of fun there.
त्या दिवशी आमी जंगलात गेलतो. खूप झाडं होती. पाखरांचा आवाज ऐकू येत व्हता.,त्या दिवशी आम्ही जंगलात गेलो होतो. खूप झाडे होती. पक्ष्यांचा आवाज ऐकू येत होता.,That day we had gone to the forest. There were many trees. The sound of birds could be heard.
माझ्या वर्गात तीस पोरं हायत. सगळे वेगळ्या गावचे हायत. आमची खूप चांगली मैत्री हाय.,माझ्या वर्गात तीस मुले आहेत. सर्वजण वेगळ्या गावचे आहेत. आमची खूप चांगली मैत्री आहे.,There are thirty students in my class. Everyone is from a different village. We have a very good friendship.
बाबा रोज सकाळी शेताकडं जात्यात. दुपारी येत्यात. जेवण करून परत जात्यात.,बाबा रोज सकाळी शेताकडे जातात. दुपारी येतात. जेवण करून परत जातात.,Father goes to the farm every morning. He comes in the afternoon. He goes back after eating.
आमची म्हैस दूध खूप देती. रोज सकाळी दुधाचं भांडं भरतं. गावात विकतो थोडं.,आमची म्हैस खूप दूध देते. रोज सकाळी दुधाचे भांडे भरते. गावात थोडे विकतो.,Our buffalo gives a lot of milk. The milk vessel fills up every morning. We sell some in the village.
लग्नात खूप लोक आले व्हते. जेवण खूप चांगलं व्हतं. रातभर गाणी झाली.,लग्नात खूप लोक आले होते. जेवण खूप चांगले होते. रात्रभर गाणी झाली.,Many people had come to the wedding. The food was very good. Songs were sung throughout the night.
माझं मन अभ्यासात लागत नाय. बाहेर खेळायचंय. पण परीक्षा जवळ आलीय.,माझे मन अभ्यासात लागत नाही. बाहेर खेळायचे आहे. पण परीक्षा जवळ आली आहे.,My mind is not focused on studies. I want to play outside. But the exam is approaching.
शेजारचे काका आजारी पडले. त्यांना दवाखान्यात न्यायला लागलं. आता बरे हायत.,शेजारचे काका आजारी पडले. त्यांना दवाखान्यात न्यावे लागले. आता बरे आहेत.,The neighbour uncle fell sick. He had to be taken to the hospital. He is well now.
आम्ही नदीवर पाणी भरायला गेलो. घागरी भरल्या आन् परत आलो. वाट लांब व्हती पण मजा आली.,आम्ही नदीवर पाणी भरायला गेलो. घागरी भरल्या आणि परत आलो. वाट लांब होती पण मजा आली.,We went to the river to fill water. We filled the pots and came back. The path was long but it was fun.
आईला बरं नव्हतं म्हणून मी स्वयंपाक केला. भाकरी जरा करपली. पण सगळ्यांनी खाल्ली.,आईला बरे नव्हते म्हणून मी स्वयंपाक केला. भाकरी जरा करपली. पण सर्वांनी खाल्ली.,I cooked because mother was not well. The bhakri got a little burnt. But everyone ate it.
थंडीत गुरं सकाळी उशिरा उठत्यात. त्यांनाबी थंडी वाजती. आम्ही त्यांना गोधडी घालतो.,थंडीत जनावरे सकाळी उशिरा उठतात. त्यांनाही थंडी वाजते. आम्ही त्यांना गोधडी घालतो.,In winter the cattle wake up late in the morning. They also feel cold. We cover them with a blanket.
गावात नवीन रस्ता झाला. आता बाजारला जायला सोपं झालंय. सगळे खूश हायत.,गावात नवीन रस्ता झाला. आता बाजारला जायला सोपे झाले आहे. सर्वजण खूश आहेत.,A new road has been built in the village. It is now easier to go to the market. Everyone is happy.
माझी आजी खूप गोष्टी सांगती. देवाच्या, राजाच्या. आम्ही सगळे ऐकत बसतो.,माझी आजी खूप गोष्टी सांगते. देवाच्या, राजाच्या. आम्ही सर्वजण ऐकत बसतो.,My grandmother tells many stories. About gods and kings. We all sit and listen.
सकाळी धुकं खूप व्हतं. काय दिसत नव्हतं. हळूहळू ऊन पडलं आन् धुकं गेलं.,सकाळी धुके खूप होते. काही दिसत नव्हते. हळूहळू ऊन पडले आणि धुके गेले.,There was a lot of fog in the morning. Nothing was visible. Slowly the sun came out and the fog cleared.
आम्ही खूप दिवसांनी एकत्र जेवलो. आजोबांनी सगळ्यांना बोलावलं व्हतं. खूप गप्पा झाल्या.,आम्ही खूप दिवसांनी एकत्र जेवलो. आजोबांनी सर्वांना बोलावले होते. खूप गप्पा झाल्या.,We ate together after many days. Grandfather had called everyone. There was a lot of conversation.
पोरगा परीक्षेत नापास झाला. घरी येऊन रडत बसला. आईनं त्याला समजावलं.,मुलगा परीक्षेत नापास झाला. घरी येऊन रडत बसला. आईने त्याला समजावले.,The boy failed the exam. He came home and sat crying. Mother consoled him.
