Source,Annotated,English
आमच्या शेतात आंब्याचं झाड हाय. उन्हाळ्यात खूप आंबे लागत्यात. आम्ही खातो आन् शेजार्यांना देतो.,आमच्या शेतात आंब्याचे झाड आहे. उन्हाळ्यात खूप आंबे लागतात. आम्ही खातो आणि शेजाऱ्यांना देतो.,There is a mango tree in our field. A lot of mangoes grow in summer. We eat them and give some to neighbours.
रात्री खूप थंडी होती. गोधड्या पांघरूनही झोप आली नाय. सकाळपर्यंत जागत राहिलो.,रात्री खूप थंडी होती. गोधड्या पांघरूनही झोप आली नाही. सकाळपर्यंत जागत राहिलो.,It was very cold at night. Sleep did not come even after covering with blankets. I stayed awake until morning.
माझ्या मित्राचे बाबा परदेशात काम करत्यात. ते वर्षातनं एकदा येत्यात. तो खूप आतुरतेनं वाट बघतो.,माझ्या मित्राचे बाबा परदेशात काम करतात. ते वर्षातून एकदा येतात. तो खूप आतुरतेने वाट पाहतो.,My friend's father works abroad. He comes once a year. He waits very eagerly.
आम्ही सगळे भावंडं एकत्र खेळतो. कधी भांडतो बी. पण रात्री एकत्र झोपतो.,आम्ही सर्व भावंडे एकत्र खेळतो. कधी भांडतोही. पण रात्री एकत्र झोपतो.,We all siblings play together. We also fight sometimes. But we sleep together at night.
गावातला कुत्रा रोज आमच्या घराजवळ येतो. आम्ही त्याला भाकरी देतो. तो शेपूट हलवत जातो.,गावातला कुत्रा रोज आमच्या घराजवळ येतो. आम्ही त्याला भाकरी देतो. तो शेपूट हलवत जातो.,The village dog comes near our house every day. We give him bhakri. He leaves wagging his tail.
काल रातच्याला वारा खूप सुटला. छपराचं एक पत्रं उडालं. सकाळी बाबांनी दुरुस्त केलं.,काल रात्री वारा खूप सुटला. छपराचे एक पत्रा उडाले. सकाळी बाबांनी दुरुस्त केले.,There was strong wind last night. One sheet of the roof flew away. Father repaired it in the morning.
माझ्या वर्गात एक नवीन मुलगी आली. ती दुसऱ्या गावची हाय. आम्ही तिला मैत्रीण केली.,माझ्या वर्गात एक नवीन मुलगी आली. ती दुसऱ्या गावची आहे. आम्ही तिला मैत्रीण केले.,A new girl came to my class. She is from another village. We made her our friend.
आमच्या घरी पाहुणे आले व्हते. आईनं खूप जेवण केलं. रात्री गप्पा मारत बसलो.,आमच्या घरी पाहुणे आले होते. आईने खूप जेवण केले. रात्री गप्पा मारत बसलो.,Guests had come to our house. Mother cooked a lot of food. We sat chatting at night.
पाऊस थांबला आन् इंद्रधनुष्य दिसलं. पोरं बाहेर धावली. सगळे बघत राहिले.,पाऊस थांबला आणि इंद्रधनुष्य दिसले. मुले बाहेर धावली. सर्वजण बघत राहिले.,The rain stopped and a rainbow appeared. The children ran outside. Everyone kept looking at it.
बाबांनी शेतात विहीर खणली. आता पाण्यासाठी लांब जावं लागत नाय. शेतीला पाणी मिळतं.,बाबांनी शेतात विहीर खणली. आता पाण्यासाठी लांब जावे लागत नाही. शेतीला पाणी मिळते.,Father dug a well in the farm. Now we do not have to go far for water. The farm gets water.
थंडीच्या दिवसात सकाळी उठणं जड जातं. गोधडी सोडायची इच्छा नसती. तरी उठावंच लागतं.,थंडीच्या दिवसात सकाळी उठणे जड जाते. गोधडी सोडायची इच्छा नसते. तरी उठावेच लागते.,It is hard to get up in the morning during winter days. One does not feel like leaving the blanket. But one has to get up.
आमची शाळा डोंगराच्या पायथ्याशी हाय. रोज चालत जातो. वाटेत खूप झाडं असत्यात.,आमची शाळा डोंगराच्या पायथ्याशी आहे. रोज चालत जातो. वाटेत खूप झाडे असतात.,Our school is at the foot of the hill. We walk every day. There are many trees along the way.
गावातनं शहरात जायला बस एकच हाय. सकाळी जाती आन् संध्याकाळी येती. चुकली तर खूप त्रास.,गावातून शहरात जायला एकच बस आहे. सकाळी जाते आणि संध्याकाळी येते. चुकली तर खूप त्रास.,There is only one bus from the village to the city. It goes in the morning and comes in the evening. It is very troublesome if you miss it.
आमच्या अंगणात तुळस हाय. आई रोज सकाळी तिला पाणी घालती. सांजवेळी दिवा लावती.,आमच्या अंगणात तुळस आहे. आई रोज सकाळी तिला पाणी घालते. संध्याकाळी दिवा लावते.,There is a tulsi plant in our courtyard. Mother waters it every morning. She lights a lamp in the evening.
आमच्या गावात होळी मोठ्या उत्साहात होती. सगळे रंग खेळले. पुरणपोळी खाल्ली.,आमच्या गावात होळी मोठ्या उत्साहात झाली. सर्वांनी रंग खेळले. पुरणपोळी खाल्ली.,Holi was celebrated with great enthusiasm in our village. Everyone played with colours. They ate puranpoli.
मला खूप दिवसांपासनं सायकल पायजे होती. बाबांनी आज आणली. मी खूप खूश झालो.,मला खूप दिवसांपासून सायकल पाहिजे होती. बाबांनी आज आणली. मी खूप खूश झालो.,I had wanted a bicycle for a long time. Father brought it today. I was very happy.
रात्री जेवण झाल्यावर आम्ही अंगणात पथारी टाकतो. आकाशातले तारे बघत झोपतो. थंडी असेल तर आत येतो.,रात्री जेवण झाल्यावर आम्ही अंगणात अंथरूण टाकतो. आकाशातले तारे बघत झोपतो. थंडी असेल तर आत येतो.,After dinner at night we spread our bedding in the courtyard. We sleep watching the stars. If it is cold we come inside.
काल माझ्या हाताला लागलं. आईनं हळद लावली. म्हणाली लवकर बरं होईल.,काल माझ्या हाताला लागले. आईने हळद लावली. म्हणाली लवकर बरे होईल.,I got hurt on my hand yesterday. Mother applied turmeric. She said it will heal quickly.
शेजारच्या काकूंनी आम्हाला श्रीखंड दिलं. खूप गोड व्हतं. आम्ही एकदम खाऊन टाकलं.,शेजारच्या काकूंनी आम्हाला श्रीखंड दिले. खूप गोड होते. आम्ही एकदम खाऊन टाकले.,The neighbour aunty gave us shrikhand. It was very sweet. We ate it all at once.
आमच्या गावचा मेळावा दरवर्षी होतो. सगळे एकत्र येतात. जुन्या आठवणी काढतात.,आमच्या गावचा मेळावा दरवर्षी होतो. सर्वजण एकत्र येतात. जुन्या आठवणी काढतात.,The village gathering happens every year. Everyone comes together. They reminisce about old memories.
माझा वर्गमित्र परीक्षेत पहिला आला. त्याला मास्तरांनी शाब्बासकी दिली. आम्हाला बी अभिमान वाटला.,माझा वर्गमित्र परीक्षेत पहिला आला. त्याला शिक्षकांनी शाब्बासकी दिली. आम्हालाही अभिमान वाटला.,My classmate came first in the exam. The teacher praised him. We were also proud.
आईनं नवीन साडी घेतली. सणाला नेसणार म्हणाली. ती खूप सुंदर दिसत व्हती.,आईने नवीन साडी घेतली. सणाला नेसणार म्हणाली. ती खूप सुंदर दिसत होती.,Mother bought a new saree. She said she will wear it for the festival. She was looking very beautiful.
गावातल्या मंदिरात रोज सकाळी घंटा वाजती. त्या आवाजाने जाग येती. मन शांत होतं.,गावातल्या मंदिरात रोज सकाळी घंटा वाजते. त्या आवाजाने जाग येते. मन शांत होते.,The bell rings every morning in the village temple. That sound wakes one up. The mind becomes peaceful.
बाबांनी गाय विकली. घरात पैशाची गरज व्हती. पण आम्हाला खूप वाईट वाटलं.,बाबांनी गाय विकली. घरात पैशाची गरज होती. पण आम्हाला खूप वाईट वाटले.,Father sold the cow. There was a need for money at home. But we felt very sad.
पावसाळ्यात शेतात चिखल होतो. चालताना पाय रुततात. पण शेतकरी काम सोडत नाय.,पावसाळ्यात शेतात चिखल होतो. चालताना पाय रुततात. पण शेतकरी काम सोडत नाही.,There is mud in the fields during the rainy season. Feet sink while walking. But the farmer does not stop working.
माझ्या आजीला अक्षरं येत नाय. ती बोटानं सही करती. पण तिला खूप माहिती असती.,माझ्या आजीला अक्षरे येत नाहीत. ती बोटाने सही करते. पण तिला खूप माहिती असते.,My grandmother does not know letters. She signs with her finger. But she knows a lot.
आमचं गाव लहान हाय. पण इथले लोक एकमेकांना मदत करत्यात. कुणाला त्रास झाला की सगळे धावतात.,आमचे गाव लहान आहे. पण इथले लोक एकमेकांना मदत करतात. कुणाला त्रास झाला की सर्वजण धावतात.,Our village is small. But the people here help each other. When someone is in trouble everyone comes running.
आमचे बाबा रोज रात्री आम्हाला अभ्यास करायला सांगत्यात. ते स्वतः बाजूला बसत्यात. आमचे प्रश्न सोडवतात.,आमचे बाबा रोज रात्री आम्हाला अभ्यास करायला सांगतात. ते स्वतः बाजूला बसतात. आमचे प्रश्न सोडवतात.,Our father asks us to study every night. He sits beside us himself. He solves our questions.
सणाच्या दिवशी आई लवकर उठती. स्वयंपाकघर सारवती. पुजेची तयारी करती.,सणाच्या दिवशी आई लवकर उठते. स्वयंपाकघर सारवते. पूजेची तयारी करते.,Mother wakes up early on the day of the festival. She cleans the kitchen. She prepares for the puja.
माझ्या मित्राचं घर माझ्यापेक्षा लांब हाय. तरी तो रोज वेळेवर येतो. कधी उशीर करत नाय.,माझ्या मित्राचे घर माझ्यापेक्षा लांब आहे. तरी तो रोज वेळेवर येतो. कधी उशीर करत नाही.,My friend's house is farther than mine. Still he comes on time every day. He is never late.
आमच्या गावात एक जुनी विहीर हाय. उन्हाळ्यात पण तिचं पाणी आटत नाय. सगळे त्या विहिरीवर अवलंबून हायत.,आमच्या गावात एक जुनी विहीर आहे. उन्हाळ्यातही तिचे पाणी आटत नाही. सर्वजण त्या विहिरीवर अवलंबून आहेत.,There is an old well in our village. Its water does not dry up even in summer. Everyone depends on that well.
आमी सकाळी लवकर उठून मळ्याला गेलो. तिथं कैऱ्या पाडल्या. घरी आणून लोणचं घातलं.,आम्ही सकाळी लवकर उठून बागेत गेलो. तिथे कैऱ्या पाडल्या. घरी आणून लोणचे घातले.,We woke up early in the morning and went to the orchard. We plucked raw mangoes there. We brought them home and made pickle.
माझ्या आईला शिवणकाम येतं. ती घरचे कपडे शिवती. बाहेरून शिवायला दिले नाय की पैसे वाचतात.,माझ्या आईला शिवणकाम येते. ती घरचे कपडे शिवते. बाहेरून शिवायला न दिल्याने पैसे वाचतात.,My mother knows stitching. She stitches the clothes at home. Money is saved by not giving them outside for stitching.
काल रातच्याला वीज गेली व्हती. जेवण अंधारात केलं. मोबाईलचा टॉर्च लावला.,काल रात्री वीज गेली होती. जेवण अंधारात केले. मोबाईलचा टॉर्च लावला.,The electricity had gone last night. We cooked in the dark. We turned on the mobile torch.
आमच्या गावाजवळ एक तळं हाय. त्यात मासे असत्यात. उन्हाळ्यात पाणी कमी होतं.,आमच्या गावाजवळ एक तळे आहे. त्यात मासे असतात. उन्हाळ्यात पाणी कमी होते.,There is a pond near our village. There are fish in it. The water decreases in summer.
दिवाळीत घर सजवलं. आकाशकंदील लावला. रात्री फटाके उडवले.,दिवाळीत घर सजवले. आकाशकंदील लावला. रात्री फटाके उडवले.,We decorated the house during Diwali. We hung a sky lantern. We burst crackers at night.
शेतातनं परत येताना बाबांनी कलिंगड आणलं. थंडगार होतं. आम्ही सगळ्यांनी मिळून खाल्लं.,शेतातून परत येताना बाबांनी कलिंगड आणले. थंडगार होते. आम्ही सर्वांनी मिळून खाल्ले.,Father brought a watermelon while returning from the farm. It was very cool. We all ate it together.
माझ्या घरी एक मांजर हाय. ती रोज दुधाची वाट बघती. उंदीर दिसला की धावती.,माझ्या घरी एक मांजर आहे. ती रोज दुधाची वाट पाहते. उंदीर दिसला की धावते.,There is a cat at my house. She waits for milk every day. She runs when she sees a mouse.
आम्ही नदीकाठी बसलो व्हतो. पाण्याचा आवाज ऐकत राहिलो. खूप शांत वाटत व्हतं.,आम्ही नदीकाठी बसलो होतो. पाण्याचा आवाज ऐकत राहिलो. खूप शांत वाटत होते.,We were sitting on the riverbank. We kept listening to the sound of water. It felt very peaceful.
आमच्या घरात सगळे एकत्र राहतात. आजोबा आजी बाबा आई आन् आम्ही. मोठं कुटुंब हाय.,आमच्या घरात सगळे एकत्र राहतात. आजोबा आजी बाबा आई आणि आम्ही. मोठे कुटुंब आहे.,Everyone lives together in our house. Grandfather grandmother father mother and us. It is a big family.
मास्तर आज रागात होते. कुणी गृहपाठ केला नव्हता. सगळ्यांना उभं केलं.,शिक्षक आज रागात होते. कुणी गृहपाठ केला नव्हता. सर्वांना उभे केले.,The teacher was angry today. Nobody had done the homework. Everyone was made to stand.
माझ्या आजोबांनी खूप कष्ट केले. शेत विकत घेतलं. आम्हाला शिकवलं.,माझ्या आजोबांनी खूप कष्ट केले. शेत विकत घेतले. आम्हाला शिकवले.,My grandfather worked very hard. He bought a farm. He educated us.
आज बाजारात खूप गर्दी व्हती. भाजी महाग व्हती. थोडी घेऊन लवकर आलो.,आज बाजारात खूप गर्दी होती. भाजी महाग होती. थोडी घेऊन लवकर आलो.,There was a lot of crowd in the market today. Vegetables were expensive. We bought a little and came back early.
रात्री आकाशात खूप तारे दिसत व्हते. आम्ही सगळे बाहेर बसलो. आजोबांनी तार्यांच्या गोष्टी सांगितल्या.,रात्री आकाशात खूप तारे दिसत होते. आम्ही सर्वजण बाहेर बसलो. आजोबांनी तार्यांच्या गोष्टी सांगितल्या.,Many stars were visible in the sky at night. We all sat outside. Grandfather told stories about the stars.
माझ्या बहिणीचं लग्न ठरलं. घरात आनंदाचं वातावरण हाय. तयारी सुरू झालीय.,माझ्या बहिणीचे लग्न ठरले. घरात आनंदाचे वातावरण आहे. तयारी सुरू झाली आहे.,My sister's wedding has been fixed. There is a joyful atmosphere at home. Preparations have begun.
आईनं सांगितलं की उद्या पाहुणे येणार हायत. मग घर आवरायला लागलो. सगळं साफ केलं.,आईने सांगितले की उद्या पाहुणे येणार आहेत. मग घर आवरायला लागलो. सर्व काही साफ केले.,Mother said that guests will come tomorrow. So we started tidying the house. We cleaned everything.
शेतातलं पाणी तुटलं. पीक सुकू लागलं. बाबा काळजीत पडले.,शेतातले पाणी तुटले. पीक सुकू लागले. बाबा काळजीत पडले.,The water supply to the farm stopped. The crop started drying up. Father became worried.
माझा मित्र शहरात शिकायला गेला. आम्हाला त्याची खूप आठवण येती. कधी कधी फोनवर बोलतो.,माझा मित्र शहरात शिकायला गेला. आम्हाला त्याची खूप आठवण येते. कधी कधी फोनवर बोलतो.,My friend went to the city to study. We miss him a lot. Sometimes we talk on the phone.
आमच्या गावात एक डोंगर हाय. त्यावर देवाचं मंदिर हाय. दरवर्षी यात्रा होती.,आमच्या गावात एक डोंगर आहे. त्यावर देवाचे मंदिर आहे. दरवर्षी यात्रा होते.,There is a hill in our village. There is a temple of God on it. A fair is held there every year.
